Title,Director,Cast,genres,combo
balakrishnudu,pavan mallela,nara rohit regina cassandra ramya krishnan adithya menon ajay,Adventure Action Comedy,balakrishnudu pavan mallela nara rohit regina cassandra ramya krishnan adithya menon ajay Adventure Action Comedy
devi sri prasad,sri kishore,bhupal raju manoj nandam dhanraj pooja ramachandran,Action Drama,devi sri prasad sri kishore bhupal raju manoj nandam dhanraj pooja ramachandran Action Drama
jandhyala rasina premakatha,krishna varma,sekhar sri lakshmi gayatri gupta dileep kumar,un_known,jandhyala rasina premakatha krishna varma sekhar sri lakshmi gayatri gupta dileep kumar un_known
june 1:43,bhaskar bantupalli,aditya srivastava richa saxena arun babu dimple,un_known,june 1:43 bhaskar bantupalli aditya srivastava richa saxena arun babu dimple un_known
mental madhilo,vivek athreya,sree vishnu nivetha pethuraj amrutha srinivasan nara rohit,Romance Comedy,mental madhilo vivek athreya sree vishnu nivetha pethuraj amrutha srinivasan nara rohit Romance Comedy
oxygen,a. m. jothi krishna,gopichand raashi khanna anu emmanuel jagapathi babu shaam abhimanyu singh,Crime Drama Mystery Thriller,oxygen a. m. jothi krishna gopichand raashi khanna anu emmanuel jagapathi babu shaam abhimanyu singh Crime Drama Mystery Thriller
jawaan,b. v. s. ravi,sai dharam tej mehreen pirzada prasanna subbaraju,un_known,jawaan b. v. s. ravi sai dharam tej mehreen pirzada prasanna subbaraju un_known
sapthagiri llb,charan lakkaakula,saptagiri kashish vohra saikumar pudipeddi shakalaka shankar,Romance Comedy Drama,sapthagiri llb charan lakkaakula saptagiri kashish vohra saikumar pudipeddi shakalaka shankar Romance Comedy Drama
b. tech babulu,seenu imandi,nandu srimukhi ali pavithra lokesh naval kishore,un_known,b. tech babulu seenu imandi nandu srimukhi ali pavithra lokesh naval kishore un_known
malli raava,gowtam tinnanuri,sumanth aakanksha singh kadambari kiran annapoorna,Drama Family Romance,malli raava gowtam tinnanuri sumanth aakanksha singh kadambari kiran annapoorna Drama Family Romance
premika,mahindra,tanish alladi shruti yagal,un_known,premika mahindra tanish alladi shruti yagal un_known
vanavillu,lanka prateek prem karan,lanka prateek prem karan shravya rao surekha vani kasi vishwanath,un_known,vanavillu lanka prateek prem karan lanka prateek prem karan shravya rao surekha vani kasi vishwanath un_known
kiss kiss bang bang,karthik medikonda,kiran harshada kulkarni mahesh kathi gayathri gupta,Comedy Crime Action,kiss kiss bang bang karthik medikonda kiran harshada kulkarni mahesh kathi gayathri gupta Comedy Crime Action
idhi maa prema katha,ayodhya karthik,anchor ravi meghana lokesh prabhas seenu priyadarshi pullikonda,un_known,idhi maa prema katha ayodhya karthik anchor ravi meghana lokesh prabhas seenu priyadarshi pullikonda un_known
juliet lover of idiot,ajay vodhirala,naveen chandra niveda thomas abhimanyu singh ester noronha ali,Drama Romance Comedy,juliet lover of idiot ajay vodhirala naveen chandra niveda thomas abhimanyu singh ester noronha ali Drama Romance Comedy
kutumba katha chitram,v. s. vasu,nandu sreemukhi kamal kamaraju,Romance Horror Thriller,kutumba katha chitram v. s. vasu nandu sreemukhi kamal kamaraju Romance Horror Thriller
lacchi,eeshwar,tej dilip raghu babu jayathi tejaswini thagubothu ramesh dhanraj sukhram,Comedy Thriller,lacchi eeshwar tej dilip raghu babu jayathi tejaswini thagubothu ramesh dhanraj sukhram Comedy Thriller
mama o chandamama,vishaka venkat,ram karthik sana maqbool suman jeeva,un_known,mama o chandamama vishaka venkat ram karthik sana maqbool suman jeeva un_known
padipoya nee mayalo,rk kampally,arun gupta saveri durgam jayavardhan,un_known,padipoya nee mayalo rk kampally arun gupta saveri durgam jayavardhan un_known
seetha...ramuni kosam,anil gopi reddy,sharath sreerangam karunya chowdhary thagubothu ramesh bala,un_known,seetha...ramuni kosam anil gopi reddy sharath sreerangam karunya chowdhary thagubothu ramesh bala un_known
tholi parichayam,l. radha krishna,venky lasya rajeev kanakala viva harsha,un_known,tholi parichayam l. radha krishna venky lasya rajeev kanakala viva harsha un_known
undha ledha,siva prasad,ramakrishna ankitha,un_known,undha ledha siva prasad ramakrishna ankitha un_known
middle class abbayi,venu sree raam,nani sai pallavi bhumika chawla,Action Comedy Family,middle class abbayi venu sree raam nani sai pallavi bhumika chawla Action Comedy Family
e ee,ram ganapati rao,neiraj sham naira shah thagubothu ramesh krishna bhagawan,Drama Romance,e ee ram ganapati rao neiraj sham naira shah thagubothu ramesh krishna bhagawan Drama Romance
hello,vikram kumar,akhil akkineni kalyani priyadarshan jagapathi babu ramya krishna ajay,Romance Drama,hello vikram kumar akhil akkineni kalyani priyadarshan jagapathi babu ramya krishna ajay Romance Drama
okka kshanam,vi anand,allu sirish surbhi seerat kapoor srinivas avasarala jayaprakash,un_known,okka kshanam vi anand allu sirish surbhi seerat kapoor srinivas avasarala jayaprakash un_known
2 countries,n. shankar,sunil manisha raj sanjjanaa naresh,un_known,2 countries n. shankar sunil manisha raj sanjjanaa naresh un_known
